Código,Empresa,Setor,Preço,P/VP,DY
AAZQ11,Outros,"8,18","12,81%","5,73%","0,95",196.625.000,535.260,0,"0,00","0,00","0,00%","0,00%",
ABCP11,Shoppings,"79,85","9,55%","9,86%","0,72",376.020.000,68.134,1,"5.247,10","634,43","12,09%","1,22%","Avenida Industrial, 600, Centro, Santo André - SP"
ADSH11,Multicategoria,"10,50","-0,03%","0,76%","1,04",482.423.000,11.672.200,1,"12.511,10","0,00","0,00%","1,40%","Avenida Afonso Vaz de Melo, nº 640, cidade de Belo Horizonte, 
estado de Minas Gerais"
AEFI11,Outros,"174,90","8,55%","0,00%","1,75",411.893.000,0,0,"0,00","0,00","0,00%","0,00%","Rua da Consolação, nºs 2.320 e 2.322 - São Paulo/SP,Av. Dr. Rudge Ramos, nº 1.501 - São Bernardo do Campo/SP,Avenida Beira Rio, 3.001, Jardim Europa - Cuiabá/MT,Avenida São Luís Rei de França, 32, Turu - São Luís/MA,Rua Timbiras, 1387, Funcionários - Belo Horizonte/MG,Avenida Presidente Juscelino Kubitschek, n° 227/229 e 247, Centro - Betim/MG,Rua Senador Fláquer, 456 - Centro - Santo André-SP"
AERO11,Logística,"100,01","0,00%","0,00%","1,02",62.732.400,0,0,"0,00","0,00","0,00%","0,00%",
AFCR11,Multicategoria,"103,15","12,61%","0,00%","1,07",498.867.000,0,0,"0,00","0,00","0,00%","0,00%",
AFHF11,Outros,"10,02","7,41%","11,27%","0,98",50.100.000,108.154,0,"0,00","0,00","0,00%","0,00%",
AFHI11,Multicategoria,"95,95","11,43%","12,44%","1,01",459.523.000,890.518,0,"0,00","0,00","0,00%","0,00%",
AFOF11,Títulos e Val. Mob.,"91,60","0,82%","0,00%","12,28",1.390.540.000,0,0,"0,00","0,00","0,00%","0,00%",
AGCX11,Varejo,"1.235,50","0,53%","0,00%","11,57",19.291.500.000,0,82,"63.941,30","468,90","0,73%","3,86%","Rua Antônio Vieira, 24 - Loja A,Rua 7 de Setembro, 1100,Avenida Manoel José de Arruda, 3100,Rua Major Claudiano, 1800, Loja, Centro,Av. Senador Queiroz, nº 85 a 111 - Lj 1 a 3,Rua Visconde de Pirajá, 127,Av. Paulista, 1.227,Av. Afrânio de Melo Franco, 131,Av. Paulista, 436,Rua Marechal Deodoro, 195,Rua Sesefredo Klein Doll, 12,Via Anchieta, 1.558,Rua Serra do Japi, 647,Rua. Senador Flaquer, 305,Av. das Américas, 15.545,Rua Santa Filomena, nºs 677, 687 e 697, Centro,Rua João de Almeida, 72,Av. República do Chile, nº 230,Lg. Páteo do Colégio, 1,EQ 406/407-SUL  Lote 1 - Brasília - DF,Praça Pio X, 78,Avenida Salgado Filho, 1301  Centro,Rua Dias da Cruz, 28-A,Av. João Pinheiro, 500,Avenida Doutor Rudge Ramos, 1501, Rudge Ramos,Avenida República Argentina, 4044, Loja,Av. Senador Queiroz, 85 a 111 - Lj 4 e 5,Av Eng. Luiz Carlos Berrini, 1307,Rua dos Italianos, 609,Rua Pedro I, 373,Rua dos Timbiras, 1375, Boa Viagem ,Avenida Rui Barbosa, 205, Loja, Centro,Av. Mateo Bei, 3286,Av. de Pinedo, 228,Av. Santa Catarina, 287,Av. Barão de Itapura, 2233,Av. Paulista, 726 - L1,Praça Visconde de Mauá, 20,Est. Rio do A, 1131,Rua Desembargador Góes Cavalcante, 261,Rua Floriano Peixoto, 915,Rua Mariz e Barros, 79,R. Pedro Vicente, 222,Av. Padre Antônio Jose Dos Santos, 872,Av. Rio Branco, 311-B,Avenida Jorge Zarur, 100,Avenida das Esmeraldas, 512,Av. Duque de Caxias, 200 - Sta. Ifigênia,Avenida São Luís Rei de França, 32, Turu,Rua Sete, 825, Loja, Centro,Av. Sto. Amaro, 3332 ,Av. do Cursino, 1348,Rua da Quitanda, 70,Avenida Presidente Kubitschek, 227, Centro,Rua Silva Bueno, 2374, Loja, Ipiranga,Rua Imperador Dom Pedro II, 255,Av. do Imperador, 3892,Rua Buenos Aires, 48,Av. Rio Branco, 115,Av. Liberdade, 151,Estrada de Taipas, 355,Rua Alves Guimarães, 50,R. Barao de Jundiai, 884,Av. Marechal Floriano Peixoto, nº 2.370,Rua Paes Leme, 250/258,Estrada do Pernambuco, 500,Rua Oscar Freire, 585, Jardins,Av. Marechal Câmara, nº 160,Avenida Vereador João Batista Fitipaldi, 115,Av Paulista 447 Loja ,Rua Coronel Abílio Soares, 163, Centro,R. Marechal Deodoro, 460, Rua da Consolação, 2320"
AGRX11,Outros,"8,89","7,74%","5,99%","0,85",159.159.000,338.353,0,"0,00","0,00","0,00%","0,00%",
AIEC11,Escritórios,"60,99","5,99%","6,61%","0,80",294.276.000,2.022.320,2,"11.674,20","906,47","7,76%","0,00%","Avenida das Nações Unidas, 14.171 - Chucri Zaidan - São Paulo - SP,Avenida Presidente Wilson, 118 - Centro - Rio de Janeiro - RJ"
AJFI11,Shoppings,"8,27","7,98%","7,82%","0,75",278.087.000,227.365,12,"597,15","58,86","9,86%","3,30%","Av. Rolf Wiest, n° 333 , Bom Retiro - 89223-005, Joinville - SC, ,R. Sete de Setembro, n° 1213 , Centro - 89010-911, Blumenau - SC, ,Esquina Rod. SC 281, Distrito Industrial - 88104-801, Grande Florianópolis - SC,Av. Santa Catarina, nº 1, Estados - 88339-005, Balneário Camboriú - SC,Rodovia BR-470, nº  3000, Salto Norte - 89065-800, Blumenau - SC,Rodovia BR-470, nº  3000, Salto Norte - 89065-800, Blumenau - SC,Av. Rolf Wiest, n° 333 , Bom Retiro - 89223-005, Joinville - SC, ,Esquina Rod. SC 281, Distrito Industrial - 88104-801, Grande Florianópolis - SC,R. Sete de Setembro, n° 1213 , Centro - 89010-911, Blumenau - SC, ,Av. Jorge Elias de Lucca, nº 765, Nossa Senhora da Salete - 88813-901, Criciúma - SC,Av. Santa Catarina, nº 1, Estados - 88339-005, Balneário Camboriú - SC,Av. Jorge Elias de Lucca, nº 765, Nossa Senhora da Salete - 88813-901, Criciúma - SC"
ALMI11,Escritórios,"630,02","7,35%","6,80%","0,31",70.043.700,11.726,1,"1.567,31","229,74","14,66%","46,80%","Avenida Almirante Barroso, 81, Sem Complemento, Centro, Rio De Janeiro/RJ, Brasil, 20031-004"
ALZC11,Outros,"7,85","12,25%","15,62%","0,84",154.971.000,250.276,0,"0,00","0,00","0,00%","0,00%",
ALZM11,Títulos e Val. Mob.,"6,40","11,76%","0,00%","0,86",97.155.500,0,0,"0,00","0,00","0,00%","0,00%",
ALZR11,Multicategoria,"10,55","9,02%","9,46%","0,99",1.340.530.000,2.318.490,23,"3.391,83","291,22","8,59%","11,25%","Avenida Professor Ascendino Reis, 549, Sem Complemento, Vila Clementino, Sao Paulo/SP, Brasil, 04027-000,Rod. Anhanguera, 28, Sem Complemento, Cravinhos, Cravinhos/SP, Brasil, 14140-000,Rua Fritz Reimann, 500, Sem Complemento, Vila Sao Joao, Guarulhos/SP, Brasil, 07044-020,Avenida Americo Ribeiro Dos Santos, 385, Sem Complemento, Parque Bandeirantes I (nova Veneza), Sumaré/SP, Brasil, 13181-715,Rod. Dr. Gov. Ademar Pereira De Barros, Km 195, 195, , , Espirito Santo Do Pinhal/SP, Brasil, 13990-000,Avenida Das Nacoes Unidas, 18001, Sem Complemento, Santo Amaro, Sao Paulo/SP, Brasil, 04795-900,Rua Ministro Godoi, 1697, Sem Complemento, Perdizes, Sao Paulo/SP, Brasil, 05015-001,Avenida Sumare, 1500, Sem Complemento, Perdizes, Sao Paulo/SP, Brasil, 05016-110,Avenida Conselheiro Rodrigues Alves, 300, Sem Complemento, Vila Mariana, São Paulo/SP, Brasil, 04014-000,Avenida Nacoes Unidas, 51, 51 - 15, Jardim Godoy, Bauru/SP, Brasil, 17021-365,Avenida Francisco Prestes Maia, 1497, Sem Complemento, Centro, São Bernardo Do Campo/SP, Brasil, 09770-000,Avenida Brasil, 33809, Sem Complemento, Bangu, Rio De Janeiro/RJ, Brasil, 21852-002,Rua Arapore, 655, Sem Complemento, Jardim Guedala, Sao Paulo/SP, Brasil, 05608-001,Avenida Marginal  Armando Zampini, 28, Sem Complemento, Cravinhos, Cravinhos/SP, Brasil, 14140-000,Avenida Duquesa De Goias, 381, Sem Complemento, Real Parque, Sao Paulo/SP, Brasil, 05686-001,Rua Pasquale Gallupi, 7, Sem Complemento, Paraisópolis, São Paulo/SP, Brasil, 05660-000,Rua Barao De Penedo, 435, Sem Complemento, Cidade Industrial Satelite De Sao Paulo, Guarulhos/SP, Brasil, 07222-015,Avenida Presidente Juscelino Kubitschek De Oliveira, 3530, Sem Complemento, Jardim Moysés Miguel Haddad, São José Do Rio Preto/SP, Brasil, 15093-215,Avenida Dom Helder Camara, 3.203, Sem Complemento, Del Castilho, Rio De Janeiro/RJ, Brasil, 21050-624,Rua Pacheco Leao, 70, Sem Complemento, Jardim Botanico, Rio De Janeiro/RJ, Brasil, 22460-030,Avenida Carioca, 798, Antigo Numero 70, Lote 30, Vila Carioca, Sao Paulo/SP, Brasil, 04225-002,Avenida Dos Estados, S/n, Sem Complemento, Vila Metalurgica, Santo Andre/SP, Brasil, 09220-570,Rua Padre Adelino, 758, Sem Complemento, Quarta Parada, Sao Paulo/SP, Brasil, 03303-000"
ALZT11,Títulos e Val. Mob.,"33,00","15,52%","0,00%","0,79",16.500.000,0,0,"0,00","0,00","0,00%","0,00%",
ANCR11,Shoppings,"600,00","1,32%","0,24%","5,04",20.830.600.000,5.180,10,"47.889,90","970,07","2,03%","4,13%","Avenida Bernardo Vieira, lado par, esquina com a Avenida Dr. José Gonçalves, no bairro de Lagoa Nova, zona urbana/sul, Natal/RN,R. Itacaiúna, 61 - Vila Andrade - São Paulo - SP,Av. Cristiano Machado, nº 4000, Belo Horizonte/MG,Av. Praia de Botafogo, 400 - Botafogo, Cep: 22250-040 - Rio de Janeiro - RJ - Brasil.,Av. Abílio Augusto Távora, 1111 - Luz, Nova Iguaçu - RJ,Av. Senador Salgado Filho, nº 2.234 - Candelária - Natal/Rio Grande do Norte,Conjunto A, T137 - Asa Norte - Distrito Federal - Brasília - DF - Brasil. CEP: 70077-900,Rua Dr. José Borges, no bairro de Lagoa Nova, zona suburbana, Natal/RN,Av. Bezerra de Menezes, 2450 - Presidente Kennedy - Fortaleza - CE,Av. Deputado Benedito Matarazzo, 9403 - Jardim Oswaldo Cruz - São José dos Campos - SP"
APTO11,Residencial,"8,26","13,05%","12,64%","0,84",38.097.000,41.184,3,"16.084,60","1.112,22","6,91%","0,00%","Alameda Fernão Cardim, 70 e 72  Jardim Paulista  Estado
de São Paulo,Rua Jerônimo da Veiga nº 248, no 28º Subdistrito Jardim Paulista, São Paulo - SP,Alameda Fernão Cardim, 70  Jardim Paulista  Estado
de São Paulo"
APXM11,Shoppings,"78,20","4,95%","5,53%","0,61",221.239.000,571.123,1,"1.208,63","161,31","13,35%","100,00%","Avenida Americo Buaiz, 200, Gleba A, Enseada Do Sua, Vitoria/ES, Brasil, 29050-902"
ARCT11,Multicategoria,"87,13","-60,77%","0,00%","0,86",368.999.000,0,12,"1.100,84","99,19","9,01%","0,00%","Brasilia, Quadra 24, Módulo 1, Setor Habitacional Mestre D armas (planaltina), Brasília/DF, Brasil, 00073-405,Avenida Santos Dumont, 4235, Loteamento Jardim Marilu, Vila Aeroporto, Mirassol/SP, Brasil, 15135-160,Rodovia Juscelino Kubitscheck De Oliveira  Br 364, S/n, Sem Complemento, Área Rural De Frutal, Frutal/MG, Brasil, 00038-207,Avenida Juscelino Kubitschek De Oliveira, 154, Blocos A, B, C, Centro, Votorantim/SP, Brasil, 18110-901,Lote 47 A, Sn, Sem Complemento, Porto Dos Gaúchos, Porto Dos Gaúchos/MT, Brasil, 78560-000,Avenida Costa E Silva, 1275, Sem Complemento, Vila Progresso, Campo Grande/MS, Brasil, 79050-410,Alameda Das Mansoes, 414, Chacaras 414 415 441 442 412 413 443 E 444, Chacaras Mansoes Rosas De Ouro, Goiania/GO, Brasil, 74470-060,Rodovia Washington Luis, Km.198, Sem Complemento, , Corumbatai/SP, Brasil, 13540-000,Rua Professor Luciano Prata, 204, Sem Complemento, Vila Baruel, Sao Paulo/SP, Brasil, 02510-020,Rodovia Br020, 527, Sem Complemento, Campo Grande, Caucaia/CE, Brasil, 61663-015"
AROA11,Multicategoria,"1,30","6,20%","6,48%","1,37",218.305.000,6.421,6,"1.617,65","112,02","6,92%","0,00%","Rua Dragão do Mar,S/N-Aracati-CE,AVENIDA DOUTOR SILAS MUNGUBA, Nº 847 - PARANGABA -
FORTALEZA / CE,Avenida Luciano Magalhães esquina com a Rua José Félix da Silva,663-Canindé-CE,Rua Doutor Pinto de Mendonça,S/N-Quixeramobim-CE,Rodovia Doutor Mendel Steinbruch,S/N-Maracanaú-CE,Avenida Comandante Aviador Childerico Mora,S/N-Maranguape-CE"
ARRI11,Multicategoria,"6,33","11,61%","16,52%","0,76",131.202.000,297.324,0,"0,00","0,00","0,00%","0,00%",
ARTE11,Residencial,"10,34","8,14%","0,00%","0,98",98.239.300,498,0,"0,00","0,00","0,00%","0,00%",
ARXD11,Multicategoria,"7,83","15,12%","13,93%","0,86",69.112.000,73.871,0,"0,00","0,00","0,00%","0,00%",
ASMT11,Outros,"4,10","6,27%","0,00%","0,41",70.113.800,518,3,"4.554,15","766,71","16,84%","0,00%","Avenida Independencia, 565, Imóvel Porto Alegre, Independência, Porto Alegre/RS, Brasil, 00090-035,Avenida Alfredo Egidio De Souza Aranha, 145, Edifício Souza Aranha I, Vila Cruzeiro, Sao Paulo/SP, Brasil, 04726-170,Avenida Alfredo Egidio De Souza Aranha, 145, Edifício Souza Aranha Ii, Vila Cruzeiro, Sao Paulo/SP, Brasil, 04726-170,Praia do Flamengo, 66 - Flamengo, Rio de Janeiro - RJ, 22210-030,Rua James Joule, 65 - SP,Av. Brig. Faria Lima, 1306 - SP"
ASRF11,Multicategoria,"10.974,00","-1,08%","0,00%","1,14",43.896.000,1.045,2,"7.067,05","0,00","0,00%","0,00%","Rua Jose Antonio Coelho, 484, Sem Complemento, Vila Mariana, Sao Paulo/SP, Brasil, 04011-061,Rua Jose Antonio Coelho, 486, Sem Complemento, Vila Mariana, Sao Paulo/SP, Brasil, 04011-061"
ATSA11,Shoppings,"58,19","6,42%","4,67%","0,79",101.899.000,2.997,1,"2.968,02","206,18","6,95%","16,68%","Rua Giovanni Battista Pirelli, 155 - Vila Homero Thon - Santo André - SP"
AURB11,Logística,"72,92","6,21%","4,45%","0,90",79.175.100,223.221,2,"1.957,16","170,78","8,73%","0,00%","Estrada Da Olaria, 640, Sem Complemento, Vila Pires, Guarulhos/SP, Brasil, 00007-271,Avenida Papa Joao Xxiii, 3.580, Sem Complemento, Loteamento Industrial Coral, Maua/SP, Brasil, 09370-800"
AZPL11,Logística,"7,80","7,09%","11,98%","0,91",326.997.000,934.369,1,"1.591,55","132,78","8,34%","0,00%","Rodovia Presidente Tancredo de Almeida Neves, Km 45, s/nº. Franco da Rocha."
BARI11,Outros,"79,20","13,79%","6,02%","1,01",367.028.000,0,1,"0,00","0,00","0,00%","0,00%",
BBFI11,Escritórios,"629,00","-5,43%","99,06%","18,55",81.770.000,0,0,"0,00","0,00","0,00%","0,00%","Rua Barao De Sao Francisco, 177, Entrada Pela Rua Gomes Braga, 65, Andarai, Rio De Janeiro/RJ, Brasil, 20560-031"
BBFO11,Multicategoria,"71,41","15,06%","12,79%","0,92",285.918.000,678.491,0,"0,00","0,00","0,00%","0,00%",
BBGO11,Outros,"75,19","19,85%","7,95%","0,81",301.148.000,339.739,0,"0,00","0,00","0,00%","0,00%",
BBIG11,Shoppings,"7,20","15,89%","13,08%","0,75",713.671.000,1.286.260,3,"10.117,90","738,66","7,30%","1,60%","Rua Lauro Müller, 116 - Botafogo, Rio de Janeiro - RJ, 22290-070,Rua Dr. Veiga Filho, 133, Higienópolis, São Paulo - 01229-001,Rua Treze de Maio, 1947 - Bela Vista, São Paulo - 01327-900"
BBPO11,Escritórios,"96,75","10,42%","0,00%","0,95",1.540.230.000,0,61,"3.690,03","479,56","13,00%","1,44%","AV.13 DE MAIO,13,AV.SANTOS DUMONT,2889,R.VOLUNTARIOS DA PATRIA,1769,PRACA GENERAL VALADÃO,377,AV.GOV.PEDRO DE TOLEDO,1101,AV.PRES.KENNEDY,1461,AV.JABAQUARA 424,R. JOAQUIM NABUCO, 246,Av. W3, Quadra 7 ,R.PINHEIROS,1492,R.RIO DE JANEIRO,750,AV.AFONSO PENA,2202,Rua Guilherme Moreira, 315,AV. AFONSO PENA, 745, ESQUINA R. QUINTINO BOCAIUVA,PR.TIRADENTES,410/AL.DR. MURICY,760/R. CANDIDO LOP,R.BOM PASTOR,153/169,Praça Floriano Peixoto/R.PAULO EIRO,471,PCA.RUI BARBOSA,1-55/R.ANT. ALVES, 9-38,AV.S.JOAO,32/R.LIBERO BADARO,568/R.S.BENTO,465,AV.SANTA MARINA 2618,R.DR.NELSON D AVILA,149-CENTRO,PCA. RUI BARBOSA, 322,AV.CONSELHEIRO CARRAO,2411,PRACA XV DE NOVEMBRO, 321,R. BENTO GONCALVES, 516,R.JULIO CONCEICAO,438,QD. 1, BL.G, LT. 32,RUA MORAIS BARROS, 721,R.ESPIRITO SANTO,571, ESQ. C/ RUA CARIJÓS, 185,R.BARORE,284,ALAMEDA DOS JURUPIS, 1156,AV.N.SRA.COPACABANA,594,AV.RIO BRANCO,1437,AV.GEREMARIO DANTAS,78,PCA.CARDEAL ARCOVERDE,52,AV.PRES.VARGAS,248,RUA SAO BENTO, 483 / RUA LIBERO BADARO, 582,Av. Goiás, 980 - Quadra 14,R.VOLUNTARIOS DE S.PAULO,2975,AV.BARTOLOMEU MITRE 438-A,RUA MARQUES DO HERVAL, 1354, EDIFICO SATELITE,Praça XV de Novembro, 329,R.DUQUE DE CAXIAS,725,R.DOMINGOS DE MORAES, 438,R.DR.COSTA AGUIAR,626,SDN CONJ A LOJA C-03 2 PAVIMENTO,R.HONORIO SILVEIRA DIAS,1830,R.TAMOIOS,731/R. GUARANI, 504,SEPN QUADRA 504 BL B EDIFICIO VIRGO,AV.PENHA DE FRANCA,549,PCA.DAS 4 JORNADAS,11,R.NOSSA SENHORA DA LAPA, 281,RUA 7 DE SETEMBRO, 1209,R.DA BAHIA,2500,R. FELINTO MULLER, 2104/PRES.JOSE LINHARES, 50,Rua Professor Álvaro Rodrigues, nº 355, Loja A / Botafogo / RJ,RUA XV DE NOVEMBRO, N. 191,AV.ERNANI AMARAL PEIXOTO, 347"
BBRC11,Outros,"103,97","11,34%","12,90%","0,99",165.312.000,99.810,21,"9.903,16","1.304,20","13,17%","12,53%","R. Guaipá, 1379, São Paulo-SP,Av. Prof. Francisco Morato, 1214, São Paulo-SP,Av. Santo Amaro, 2163, São Paulo-SP,Av. Brasil, 418, São Paulo-SP,Av. Portugal, 519, Santo André-SP,Av. Gal. Pedro Pinho, 635, Osasco-SP,R. Joaquim Floriano, 666, São Paulo-SP,R. Coronel Quirino, 644, Campinas-SP,Av. Amador Bueno da Veiga, 1516, São Paulo-SP,Av. Maria Servidei Demarchi, 1658, São Bernardo do Campo-SP,R. Estados Unidos, 1931, São Paulo-SP,Av. Eng. Heitor Antônio Eiras Garcia, 3963,/3967 São Paulo-SP,Av. Paes de Barros, 2621, São Paulo-SP,Avenida Indianópolis, 476 - Indianópolis, São Paulo - SP,Av. Prof. Francisco Morato, 2004, São Paulo-SP,Rua Inácio Pereira da Rocha, 597 - Pinheiros, São Paulo - SP,Av. Eng. Luis Carlos Berrini, 559, São Paulo-SP,Rua Mal. Deodoro, 440 - Santo Amaro, São Paulo - SP,Av. São Miguel, 2328, São Paulo-SP,R. Pires da Mota, 488, São Paulo-SP,Al. Gabriel Monteiro da Silva, 2032, São Paulo-SP"
BBVJ11,Escritórios,"62,99","2,23%","0,00%","0,86",197.789.000,0,1,"10.225,30","570,89","5,58%","43,70%","Av. Magalhães de Castro, 4.800 - São Paulo/SP"
BCFF11,Títulos e Val. Mob.,"7,35","8,06%","0,00%","0,84",1.480.960.000,0,0,"0,00","0,00","0,00%","0,00%","Avenida Das Nacoes Unidas, 14261, Sem Complemento, Vila Gertrudes, Sao Paulo/SP, Brasil, 04794-000"
BCIA11,Multicategoria,"93,53","11,76%","11,82%","0,89",347.842.000,497.024,0,"0,00","0,00","0,00%","0,00%",
BCRI11,Outros,"63,64","14,01%","15,49%","0,75",398.251.000,588.983,0,"0,00","0,00","0,00%","0,00%",
BFCC11,Escritórios,"101,89","4,88%","2,00%","1,04",846.136.000,7,1,"26.092,20","1.823,67","6,99%","0,00%","Avenida Paulista, n° 1374, Bela Vista, na cidade de São Paulo, no Estado de São Paulo. Edifício Brazilian Financial Center."
BGRB11,Escritórios,"108,90","5,09%","5,47%","0,92",210.496.000,16.923,1,"42.784,20","2.916,01","6,82%","2,85%","Avenida Brigadeiro Faria Lima, nº 3.732, São Paulo, SP"
BICE11,Outros,"888,00","5,28%","5,97%","0,79",118.472.000,42,0,"0,00","0,00","0,00%","0,00%",
BICR11,Títulos e Val. Mob.,"35,92","14,26%","6,42%","0,86",17.960.000,0,0,"0,00","0,00","0,00%","0,00%",
BIME11,Outros,"6,40","10,38%","14,81%","0,75",37.411.900,47.169,1,"259,84","0,00","0,00%","0,00%",Matrícula- 237.131 14º RI
BIPD11,Outros,"989,33","-2,41%","6,67%","1,03",109.261.000,40.963,2,"8.012,38","0,00","0,00%","0,00%","Av. Prof. Fonseca Rodrigues, 143/197, Alto de Pinheiros - São Paulo / SP,Avenida Jamaris, 884, 892 e 898  Moema São Paulo / SP"
BLCA11,Escritórios,"98,78","6,40%","6,39%","0,77",158.048.000,136.037,1,"37.383,50","3.084,95","8,25%","0,00%","Avenida Brigadeiro Faria Lima, 3477, Sem Complemento, Itaim Bibi, Sao Paulo/SP, Brasil, 04538-133"
BLCP11,Logística,"91,00","5,41%","0,00%","0,81",208.962.000,0,2,"3.014,16","199,89","6,63%","0,00%","Estrada Municipal Thereza Thomazella, 432, Bairro Dos Pires, Extrema/MG, Brasil, 37640-000,Rodovia  Dom Gabriel Paulino Bueno Couto, Km 80,24, Cabreuva/SP, Brasil, 13315-000"
BLMC11,Títulos e Val. Mob.,"85,75","11,10%","0,00%","0,91",34.257.100,0,0,"0,00","0,00","0,00%","0,00%",
BLMG11,Multicategoria,"33,21","12,20%","13,26%","0,70",155.242.000,288.825,1,"2.396,18","317,61","13,25%","0,00%","Rua do Uruguai, nº 43, 55 a 59, 47, 06, 382, sub-distrito dos Mares, Salvador, Bahia"
BLMO11,Escritórios,"87,91","6,96%","7,36%","0,89",87.454.100,3.215.990,1,"10.620,70","965,29","9,09%","0,00%","Av. das Nações Unidas, nº 12.901, São Paulo - SP"
BLMR11,Títulos e Val. Mob.,"6,78","10,17%","0,00%","0,84",173.172.000,0,0,"0,00","0,00","0,00%","0,00%",
BLOG11,Multicategoria,"7,50","4,57%","3,18%","0,67",230.975.000,107,6,"1.797,97","145,71","8,10%","12,80%","Avenida Doutor Mendel Steinbruch, 11. 308,Rodovia SC - 417, 11915, Bairro Mina Velha, Garuva/SC,Rodovia BR - 101 Norte, 5.800 - Jaguaribe,Via de Ligação, 858-1.176,Av. Alfredo Bandeira de Melo, s/n - Quadra Area - Lote C - Vila Rural, Igarassu-PE,Via de Ligação Camaçari, s/n - polo industrial de Camaçari"
BLUR11,Títulos e Val. Mob.,"76,03","10,06%","1,34%","0,99",6.842.700,0,0,"0,00","0,00","0,00%","0,00%",
BMLC11,Outros,"100,00","8,30%","8,37%","0,91",99.840.500,7.093,1,"16.659,50","1.519,94","9,12%","0,00%","Rua Lauro Muller, 116, 21º, 27º, 28º E 40º Andares, Botafogo, Rio De Janeiro/RJ, Brasil, 22290-160"
BNFS11,Varejo,"54,99","21,31%","18,18%","0,79",38.493.000,90.133,18,"3.466,24","886,22","25,57%","0,44%","Av. Cecilio Monza, 10827 - Porto Alegre-RS,Av do Forte, 1128 - Porto Alegre-RS,Rua Maranhao 280 - Santa Maria-RS,Av. 20 de Setembro, 3755 - Sapiranga-RS,Rua Baltazar Brum, 320 - Quarai-RS,Av. Padre Claret  1104 - Esteio-RS,Rua Henrique Bier, 1125 - Sao Leopoldo-RS,Rua Osvaldo Aranha, 2396 - Taquari-RS,Av. Joao Pereira de Vargas, 1460 - Sapucaia do Sul-RS,Av. Flores da Cunha, 175 - Santa Rosa-RS,Rua Jose Do Patrocinio, 165 - General Camara-RS,Av. Atlantica, 537 - Rio Grande,RS,Av. Assis Brasil,  657 - Arroio do Sal-RS,Rua Moreira Paz 591 - Vacaria-RS,Av. Tomaz Edison, 2615  - Sao Leopoldo-RS,Av. Julio de Castillhos, 303 - Sao Gabriel-RS,Rua Odorico Mosmann, 257 - Parobe-RS,Av. Venancio Aires, 1745 - Cruz Alta-RS"
BPFF11,Outros,"54,52","16,27%","7,58%","0,78",244.922.000,0,0,"0,00","0,00","0,00%","0,00%",
BPML11,Multicategoria,"94,68","9,98%","11,81%","0,76",704.584.000,4.679.280,4,"5.305,80","731,14","13,78%","8,23%","Q. 107, Norte Avenida, NS 5, s/n, Shopping, Palmas, TO, 77001-098,Av. Maestro Paulo e Silva, 400, Shopping, Rio de Janeiro, RJ, 21920-445,Rua América Deolindo Garla, 224, Shopping, Londrina, PR, 86079-225,Av. Severino Ballesteros, 850 - Cabral, Contagem - MG, 32110-005"
BPRP11,Outros,"107,50","10,56%","0,00%","0,86",145.107.000,0,1,"6.230,68","692,07","11,11%","0,00%","Avenida Pl Do Brasil, 3001,  Fontes, Aruja/SP, Brasil, 07415-000"
BRCO11,Logística,"114,63","6,60%","9,28%","0,98",2.065.780.000,9.793.670,12,"4.614,20","338,24","7,33%","7,59%","Rua Eugênia S. do Rosário, 2800, Londrina - PR,Rod. BR 104 km 57, s/n - Murici - AL,Avenida Wilson Tavares Ribeiro, nº 1.651 - Contagem - MG,Estrada Turística do Jaraguá, nº 50, Jaraguá, São Paulo - SP,Rua Henry Ford, 803 - Osasco - SP,Avenida Helio Ossamu Daikuara nº 1.135,  Embu das Artes - SP,Rod. BA-535. km 23, Lauro de Freitas - BA,Rodovia Dom Gabriel Paulino Bueno Couto nº 1936 - Itupeva - SP,Avenida D com acesso a Rodovia Presidente Dutra, KM 298, Resende - RJ,Rodovia Dom Gabriel Paulino Bueno Couto, nº 1606, Itupeva - SP,Avenida Tabai-Canoas (BR 386), nº 1.200, Canoas - RS,Rua Olympia Semeraro, nº 381, 675 e 737, São Paulo - SP"
BRCR11,Multicategoria,"47,29","11,03%","10,47%","0,55",1.259.720.000,1.825.120,6,"5.043,44","699,38","13,87%","3,22%","Avenida Das Americas, 4200, Bloco 5, Barra Da Tijuca, Rio De Janeiro/RJ, Brasil, 22640-102,Avenida Joao Cabral De Mello Neto, 850, 2º, 3º, 4º, 8º, 9º,10º,11º E 12º Andares, Barra Da Tijuca, Rio De Janeiro/RJ, Brasil, 22775-057,Avenida Doutor Chucri Zaidan, 1240, Sem Complemento, Vila Sao Francisco Zona Sul, Sao Paulo/SP, Brasil, 04711-130,Avenida Das Nacoes Unidas, 14401, Sem Complemento, Vila Gertrudes, Sao Paulo/SP, Brasil, 04794-000,Avenida Doutora Ruth Cardoso, 8501, Sem Complemento, Pinheiros, São Paulo/SP, Brasil, 05425-070,Avenida Henrique Valadares, 28, Sem Complemento, Centro, Rio De Janeiro/RJ, Brasil, 00020-231"
BREV11,Híbrido,"105,00","6,59%","0,00%","0,00",101.556.000,0,13,"0,00","1.437,55","0,00%","0,00%","Rua  Joaquim Floriano, 100 - São Paulo/SP,Rua Cristiano Viana, 401 - São Paulo/SP,Avenida Brigadeiro Faria Lima, 2055 - São Paulo/SP,Alameda Santos, 1940 - São Paulo/SP,Rua Tabapuã, 500,Rua Fidêncio Ramos, 213 - São Paulo/SP,Alameda Itu, 852 - São Paulo/SP,Rua James Joule, 92 - São Paulo/SP,Avenida Brigadeiro Faria Lima, 3015 - São Paulo/SP,Avenida Doutor Cardoso de Melo, 1336 - São Paulo/SP,Rua  Helena, 260 - São Paulo/SP,Rua  Joaquim Floriano, 413 - São Paulo/SP,Rua Gomes de Carvalho, 1356 - São Paulo/SP"
BRIM11,Residencial,"284,99","-5,26%","0,00%","8,50",35.377.800,17.626,0,"0,00","0,00","0,00%","0,00%","Rua Tumiaru, nº 120 - Moema, São Paulo - SP, 04008-050"
BRIP11,Multicategoria,"443,89","-7,66%","6,44%","0,84",95.647.200,4.738,0,"0,00","0,00","0,00%","0,00%","Rua Sebastião Paes, Campo Belo-SP"
BRLA11,Logística,"148,00","7,73%","5,33%","0,89",724.795.000,0,10,"1.083,60","86,30","7,96%","0,00%","Estrada Ladeira Grande, S/n, Área 01-a, Parque Industrial, Viana/ES, Brasil, 29136-537,Km 101, Da Br-101, 101, Sem Complemento, , Conde/PB, Brasil, 58322-000,Avenida Prefeito Domingos Mocelin Neto, 2600, 555, Sem Complemento, Borda Do Campo, Quatro Barras/PR, Brasil, 83425-970,Avenida Anel De Contorno, S/n, Lote J-13b, Ayrton Senna, Vitoria Da Conquista/BA, Brasil, 45057-000,Rua Jose Lana, 850, Sem Complemento, Brilhante I, Itajai/SC, Brasil, 88318-290,Rodovia Dos Imigrantes, Km 501, Sem Complemento, Distrito Industrial, Cuiaba/MT, Brasil, 78098-325,Rua Alexandre Barreto Cavalcante, 74, Lote 01b Quadra 07, Alterosa, Ribeirao Das Neves/MG, Brasil, 33821-105,Estrada R-1, Na Esquina Com A Estrada R-4, S/n, Sem Complemento, , Querencia/MT, Brasil, 78643-000,Setor 2, Setor 2, S/n, Lote 08b3, Setor 2, Lucas Do Rio Verde/MT, Brasil, 78455-000,Avenida Pl Do Brasil, 3001, Sem Complemento, Fontes, Aruja/SP, Brasil, 07415-000"
BROF11,Multicategoria,"61,79","10,97%","10,39%","0,56",717.432.000,528.521,1,"8.099,46","1.203,95","14,86%","9,64%","Rua Do Passeio, 38, Sem Complemento, Centro, Rio De Janeiro/RJ, Brasil, 20021-290"
BTAL11,Logística,"89,40","12,72%","9,93%","0,77",534.857.000,760.868,9,"1.458,97","186,41","12,78%","0,00%","Rodovia Br467, Br 163, Km 256.5, Jardim Europa, Toledo/PR, Brasil, 85907-060,Rodovia Br 242, Km 75, S/n, Sem Complemento, Zona Rural, Nova Ubirata/MT, Brasil, 78888-000,Rua Frutal 689, 689, Sem Complemento, Centro, Iturama/MG, Brasil, 38280-971,Avenida Presidente Tancredo De Almeida Neves, 1171, Sem Complemento, Karfan, Itumbiara/GO, Brasil, 75516-475,Estrada Da Pedreira, 151, Sem Complemento, 14 De Novembro, Cascavel/PR, Brasil, 85804-180,Rua Rio Verde, 101, Sem Complemento, Paul, Vila Velha/ES, Brasil, 29115-210,Rodovia Pr 182, Km 34  Maripa/pr, Km 34, Sem Complemento, Perola Independente , Maripa/PR, Brasil, 85958-000,Br 277, Km 533, Centro De Recebimento De Grão I.riedi, Colonia Murillo, Ibema/PR, Brasil, 85478-000,Rodovia Pr 364, Km 579, Sem Complemento, , Palotina/PR, Brasil, 85950-000"
BTCI11,Outros,"9,23","12,89%","12,45%","0,91",918.580.000,2.845.770,0,"0,00","0,00","0,00%","0,00%",
